title,originallink,link,description,pubDate
"美 질 바이든 여사, 코로나19 확진",https://www.seoul.co.kr/news/newsView.php?id=20220817500001&wlog_tag3=naver,https://n.news.naver.com/mnews/article/081/0003294906?sid=104,지난달 감염 후 회복된 바이든은 ‘음성’ 조 바이든 미국 대통령의 부인인 질 바이든 여사가 16일(현지시간) 코로나19에 걸렸다. 백악관은 이날 성명을 통해 바이든 여사가 코로나19 검사에서 양성판정을 받았다고... ,"Wed, 17 Aug 2022 00:05:00 +0900"
코로나 대출 착시효과 '여전'… 6월 은행 연체율 0.2% '역대 최저',http://moneys.mt.co.kr/news/mwView.php?no=2022081713380092095,https://n.news.naver.com/mnews/article/417/0000843555?sid=101,은행들의 부실 위험이 낮아졌다기보단 2020년부터 확산한 신종 코로나바이러스 감염증(코로나19)으로 은행들이 소상공인과 자영업자 등을 대상으로 대출 만기연장과 이자 상환유예 조치 등 금융지원책을 지속한... ,"Wed, 17 Aug 2022 13:44:00 +0900"
"코로나19 백신 접종 후 월경장애…""최대 5,000만원 지원""",http://mbn.mk.co.kr/pages/news/newsView.php?category=mbn00009&news_seq_no=4825041,https://n.news.naver.com/mnews/article/057/0001683987?sid=102,"코로나19 백신을 맞은 뒤 월경장애를 겪은 여성들은 최대 5,000만 원까지 의료비를 지원 받을 수 있게... 출혈)'을 코로나19 백신 '관련성 의심' 질환으로 추가하기로 의결했습니다. '관련성 의심' 질환이란 코로나19... ","Wed, 17 Aug 2022 07:48:00 +0900"
코로나 백신 맞고 월경장애…최대 5000만원 지원받는다,http://news.mk.co.kr/newsRead.php?no=725162&year=2022,https://n.news.naver.com/mnews/article/009/0005005203?sid=102,"코로나19 백신 접종 후 월경장애를 겪어온 여성들이 1인당 의료비로 최대 5000만원을 지원받을 수 있게 됐다.... 지난 11일 대한민국의학한림원 코로나19백신안전성위원회가 빈발 월경 및 출혈, 이상자궁출혈 발생 위험이... ","Tue, 16 Aug 2022 23:38:00 +0900"
코로나 만기연장에 6월 은행대출 연체율 0.2%…역대 최저,https://www.yna.co.kr/view/AKR20220817070100002?input=1195m,https://n.news.naver.com/mnews/article/001/0013380200?sid=101,특히 코로나19로 피해를 본 소상공인의 대출에 대한 만기 연장과 상환 유예 조처가 이어지면서 연체율 하락의 직접적인 배경으로 작용하고 있다. 이 조처는 오는 9월 말 종료를 앞두고 있다. 6월 신규 연체 발생액은... ,"Wed, 17 Aug 2022 12:01:00 +0900"
'백신 4차 접종 완료' 화이자 CEO 코로나19 양성 판정,https://www.ytn.co.kr/_ln/0104_202208160130381277,https://n.news.naver.com/mnews/article/052/0001777096?sid=104,코로나19 양성 판정을 받았습니다. 불라 대표는 성명에서 화이자 백신을 4차까지 접종한 데 대해 감사한 마음이라며 매우 가벼운 증상을 겪고 있지만 상태가 좋다고 말했습니다. 또 역시 화이자에서 개발한 먹는 코로나19... ,"Tue, 16 Aug 2022 01:30:00 +0900"
"美, 이번에는 '영부인' 질 바이든 코로나 양성 판정",http://www.newsis.com/view/?id=NISX20220816_0001980418&cID=10101&pID=10100,https://n.news.naver.com/mnews/article/003/0011366384?sid=104,여사가 코로나19에 확진됐다. 바이든 여사 측 엘리자베스 알렉산더 공보국장은 16일(현지시간) 성명을 내고 이같이 밝혔다. 바이든 대통령이 지난달 코로나19에 감염된 데 이어 배우자인 바이든 여사도 확진을 피해가지... ,"Tue, 16 Aug 2022 23:38:00 +0900"
코로나 백신 접종 뒤 ‘잦은 생리·과다출혈’ 의료비 지원한다,https://www.hani.co.kr/arti/society/health/1054985.html,https://n.news.naver.com/mnews/article/028/0002602618?sid=102,"코로나19 백신을 접종받은 뒤 월경이 잦아지거나, 출혈량이 정상 범위를 넘는 등 ‘이상자궁출혈’이 있다면... 이상자궁출혈을 코로나19 백신 ‘관련성 의심 질환’에 추가했다. 백신 접종 뒤 이상반응이 발생한 시기를... ","Tue, 16 Aug 2022 19:57:00 +0900"
"화이자CEO, 백신 4번 접종에도 코로나 확진…“아주 가벼운 증상”",http://www.munhwa.com/news/view.html?no=2022081601039910019002,https://n.news.naver.com/mnews/article/021/0002526515?sid=104,"자사 치료제 팍스로비드로 치료중 ""상태 좋다...빠른 회복 자신한다"" 바이든도 4차 접종 불구 확진 사례 코로나19 백신을 제조하는 미국 제약사 화이자의 앨버트 불라 CEO가 코로나19 양성 판정을 받았다. 그는 백신을... ","Tue, 16 Aug 2022 03:41:00 +0900"
"“‘네버 코비드’, ‘코로나 비감염’으로 쓰세요”",https://news.kbs.co.kr/news/view.do?ncd=5533961&amp;ref=A,https://n.news.naver.com/mnews/article/056/0011321615?sid=103,문화체육관광부와 국립국어원은 '네버 코비드'를 대체할 쉬운 우리말로 '코로나 비감염'을 선정했다고 밝혔습니다. '네버 코비드'는 코로나19에 한 번도 걸리지 않은 상태나 한 번도 걸리지 않은 사람을 이르는 말입니다.... ,"Tue, 16 Aug 2022 15:32:00 +0900"
"올해 수능 원서접수 18일부터…코로나 확진자, 대리접수 가능",https://www.yna.co.kr/view/AKR20220816073900530?input=1195m,https://n.news.naver.com/mnews/article/001/0013377639?sid=102,"코로나19 확진 수험생과 고3 장애인 수험생은 대리접수를 할 수 있다. 교육부는 이달 18일부터 9월 2일까지... 다만, 코로나19 확진 등으로 격리 통보를 받은 수험생, 장애인(시험편의제공대상자), 수형자, 군 복무자, 입원... ","Tue, 16 Aug 2022 12:01:00 +0900"
"""영국, AZ 코로나19 백신 추가 구매 계획 없어""",https://www.yna.co.kr/view/AKR20220817004100085?input=1195m,https://n.news.naver.com/mnews/article/001/0013379145?sid=104,최윤정 특파원 = 영국이 아스트라제네카의 코로나19 백신을 추가 주문할 계획이 없는 것으로 확인됐다고 가디언이 16일(현지시간) 보도했다. 가디언에 따르면 영국 보건부는 아스트라제네카 코로나19 백신 추가... ,"Wed, 17 Aug 2022 03:53:00 +0900"
"""코로나 치료공백 막는다""…수도권 주말 당직병원 가동",http://www.newsis.com/view/?id=NISX20220817_0001980963&cID=10201&pID=10200,https://n.news.naver.com/mnews/article/003/0011367161?sid=102,코로나19 재유행에 따라 중증 기저질환자 등이 주말에도 병상을 신속하게 배정받을 수 있도록 하는 조치다. 중앙재난안전대책본부(중대본)는 17일 정례 브리핑을 통해 수도권에 코로나19 지정병상을 운영 중인 18개 병원... ,"Wed, 17 Aug 2022 11:04:00 +0900"
"코로나19 신규확진 18만803명, 18주 만에 최고… 위중증 469명",https://biz.chosun.com/topics/topics_social/2022/08/17/5HTTGLKHEVHJFMQLKCEA4BXUEY/?utm_source=naver&utm_medium=original&utm_campaign=biz,https://n.news.naver.com/mnews/article/366/0000834623?sid=102,"국내 신종 코로나바이러스 감염증(코로나19) 일일 확진자 수가 18만803명을 기록하며 지난 4월 중순 이후 최다치를 기록했다. 사망자는 42명 증가했으며, 위중증 환자는 469명을 기록했다. 중앙방역대책본부는... ","Wed, 17 Aug 2022 09:31:00 +0900"
美영부인 질 바이든 코로나…'밀접 접촉' 바이든 음성(종합),http://www.newsis.com/view/?id=NISX20220817_0001980429&cID=10101&pID=10100,https://n.news.naver.com/mnews/article/003/0011366396?sid=104,여사가 코로나19에 확진됐다. 바이든 여사 측 엘리자베스 알렉산더 공보국장은 16일(현지시간) 성명을 내고 이같이 밝혔다. 바이든 대통령이 지난달 코로나19에 감염된 데 이어 배우자인 바이든 여사도 확진을 피해가지... ,"Wed, 17 Aug 2022 00:16:00 +0900"
수도권 주말 코로나19 당직병원 운영…산모 등 고위험환자 대응(종합),https://www.yna.co.kr/view/AKR20220817029351530?input=1195m,https://n.news.naver.com/mnews/article/001/0013380136?sid=102,중증 코로나19 환자에게 신속히 병상을 배정하도록 하기 위한 당직 병원이 운영된다. 코로나19 중앙재난안전대책본부(중대본)는 17일 김성호 제2총괄조정관(행정안전부 재난안전관리본부장) 주재로 개최한 회의에서... ,"Wed, 17 Aug 2022 11:53:00 +0900"
코로나19 확진자 18주 만에 최다…정부 “주말 당직병원 운영”,https://www.hani.co.kr/arti/society/health/1055083.html,https://n.news.naver.com/mnews/article/028/0002602715?sid=102,코로나19 신규 확진자가 18만명대를 넘어 지난 4월 중순 이후 18주 만에 최다 규모로 나타났다. 정부는... 정부는 오는 20일부터 내달 25일까지 수도권 상급종합병원을 중심으로 주말에도 중증 코로나19 환자에게 신속히... ,"Wed, 17 Aug 2022 15:45:00 +0900"
"美 퍼스트레이디 질 바이든 여사, 휴가 중 코로나 확진",https://biz.chosun.com/international/international_general/2022/08/16/Z5A2GJU5XZAEDD2NGNDT3VF7TA/?utm_source=naver&utm_medium=original&utm_campaign=biz,https://n.news.naver.com/mnews/article/366/0000834557?sid=104,조 바이든 미국 대통령의 부인인 질 바이든 여사가 16일(현지 시각) 신종 코로나바이러스 감염증(코로나19)에 걸렸다. 백악관은 이날 성명을 통해 바이든 여사가 코로나19 검사에서 양성판정을 받았다고 밝혔다.... ,"Tue, 16 Aug 2022 23:20:00 +0900"
"""코로나 치료공백 막는다""…수도권 주말 당직병원 가동(종합)",http://www.newsis.com/view/?id=NISX20220817_0001981112&cID=10201&pID=10200,https://n.news.naver.com/mnews/article/003/0011367487?sid=102,코로나19 재유행에 따라 중증 기저질환자 등이 주말에도 병상을 신속하게 배정받을 수 있도록 하는 조치다.... 정부는 국립중앙의료원과 수도권에서 코로나19 지정병상을 운영 중인 17개 상급종합병원 중 3개 병원이 참여해... ,"Wed, 17 Aug 2022 12:14:00 +0900"
[속보]코로나19 신규확진 18만803명···18주새 최다치,https://www.khan.co.kr/national/health-welfare/article/202208170931001,https://n.news.naver.com/mnews/article/032/0003167021?sid=102,질병관리청 중앙방역대책본부는 17일 0시 기준 코로나19 신규 확진자가 18만803명이라고 밝혔다.... 코로나19 중증 환자 병상 가동률은 43.7%다. 보유병상 1790개 중 입원 가능 병상은 1008개다. 준·중환자를... ,"Wed, 17 Aug 2022 09:32:00 +0900"
"화이자 CEO, 백신 4번 맞고도 ‘코로나 확진’",https://biz.chosun.com/international/international_general/2022/08/16/UBR7Q4JSBRFONL725D7PUJA3M4/?utm_source=naver&utm_medium=original&utm_campaign=biz,https://n.news.naver.com/mnews/article/366/0000834324?sid=104,코로나 백신을 만드는 미국 제약사 화이자의 앨버트 불라 최고경영자(CEO)가 코로나 양성 판정을 받았다고 블룸버그 통신과 NBC뉴스 등 주요 외신이 15일(현지 시각) 보도했다. NBC에 따르면 불라는 이날 트위터에 “화이자... ,"Tue, 16 Aug 2022 10:11:00 +0900"
코로나 신규 확진 18만명…18주 만에 최대,https://www.hani.co.kr/arti/area/capital/1055014.html,https://n.news.naver.com/mnews/article/028/0002602646?sid=102,코로나19 신규 확진자가 18만명대를 넘어 지난 4월 중순 이후 18주 만에 최다치로 집계됐다. 광복적 연휴 뒤 검사량이 늘면서 확진자도 증가한 것으로 보인다. 17일 김성호 중앙재난안전대책본부(중대본)... ,"Wed, 17 Aug 2022 09:33:00 +0900"
수도권 주말 코로나19 당직병원 운영,https://www.sedaily.com/NewsView/269U160VPR,https://n.news.naver.com/mnews/article/011/0004088493?sid=103,중증 코로나19 환자의 병상 배정이 보다 원활해질 전망이다. 코로나19 중앙재난안전대책본부는 17일 김성호 제2총괄조정관(행정안전부 재난안전관리본부장) 주재로 개최한 회의에서 수도권 중증 병상 주말 당직병원 운영... ,"Wed, 17 Aug 2022 15:09:00 +0900"
"화이자 CEO도 코로나 양성…""증상 매우 경미""",http://www.newsis.com/view/?id=NISX20220816_0001978884&cID=10101&pID=10100,https://n.news.naver.com/mnews/article/003/0011363987?sid=104,"특파원 = 코로나19 백신 최대 생산사인 화이자의 최고경영자(CEO)도 결국 감염을 피해가지 못했다. 앨버트 불라 화이자 CEO는 15일(현지시간) 트위터를 통해 ""코로나19 양성 판정을 받았다""라며 ""4차례의 화이자 백신을... ","Tue, 16 Aug 2022 02:57:00 +0900"
"'백신 4차 접종 완료' 화이자 CEO, 코로나 확진",https://news.jtbc.co.kr/article/article.aspx?news_id=NB12070951,https://n.news.naver.com/mnews/article/437/0000309978?sid=104,"미국 제약사 화이자의 앨버트 불라 최고경영자(CEO)가 백신 4차 접종까지 마치고도 신종 코로나바이러스 감염증(코로나19) 양성 판정을 받았습니다. 15일(현지시간) 불라 CEO는 자신의 트위터에서 ""화이자-바이오엔테크... ","Tue, 16 Aug 2022 11:39:00 +0900"
화이자의 굴욕? 백신 4번이나 맞은 CEO 코로나 확진 판정,http://www.fnnews.com/news/202208170836030492,https://n.news.naver.com/mnews/article/014/0004884160?sid=104,신종 코로나바이러스 감염증(코로나19) 백신을 제작하는 미국 제약사 화의자의 최고경영자(CEO) 앨버트 불라가 백신 4회 접종에도 불구하고 코로나19 확진 판정을 받았다. 불라 CEO는 지난 15일(현지시각) 자신의 트위터에... ,"Wed, 17 Aug 2022 08:45:00 +0900"
코로나로 멈췄던 '부산 수제맥주 페스티벌' 3년만에 오늘 개막,https://www.news1.kr/articles/4774847,https://n.news.naver.com/mnews/article/421/0006281169?sid=102,"2020, 2021년에는 신종 코로나바이러스 감염증(코로나19) 여파로 열리지 못했다. 마지막으로 열린 2019년 페스티벌에는 약 2만7000명의 관람객이 방문했다. 전국 각지에서 모인 수제맥주 양조장에서 제조한 100여종의... ","Wed, 17 Aug 2022 07:19:00 +0900"
"빌게이츠, 오늘 '코로나 국제공조' 국회 연설한다",http://www.wowtv.co.kr/NewsCenter/News/Read?articleId=A202208160005&t=NN,https://n.news.naver.com/mnews/article/215/0001048573?sid=101,게이츠 이사장은 이날 오전 10시 국회를 찾아 김진표 국회의장 등 주요 정치권 인사와 환담한 뒤 10시 40분부터 '코로나19 및 미래 감염병 대응·대비를 위한 국제공조의 중요성과 대한민국의 리더십'을 주제로 연설한다.... ,"Tue, 16 Aug 2022 06:49:00 +0900"
"백신 4번 맞은 화이자 CEO도 코로나 확진…""매우 가벼운 증상""",https://www.yna.co.kr/view/AKR20220816001200072?input=1195m,https://n.news.naver.com/mnews/article/001/0013376512?sid=104,"강건택 특파원 = 미국 제약사 화이자의 앨버트 불라 최고경영자(CEO)가 신종 코로나바이러스 감염증(코로나19) 양성 판정을 받았다고 15일(현지시간) 회사 측이 밝혔다. 불라 CEO는 이날 성명에서 ""화이자-바이오엔테크... ","Tue, 16 Aug 2022 00:51:00 +0900"
먹는 코로나 치료제 라게브리오 5만명분 국내 추가 도입,https://www.yna.co.kr/view/AKR20220817047900530?input=1195m,https://n.news.naver.com/mnews/article/001/0013379502?sid=102,모두 15만명분 도입…국내서 4만명분 사용 방역당국은 MSD(머크앤컴퍼니)사의 코로나19 먹는치료제 '라게브리오' 5만명분을 18일 국내에 추가로 도입한다고 17일 밝혔다. 이에 따라 정부가 계약한 라게브리오 총... ,"Wed, 17 Aug 2022 10:03:00 +0900"
늘어나는 코로나19 신규 확진자,https://www.news1.kr/photos/view/?5530888,https://n.news.naver.com/mnews/article/421/0006282087?sid=102,17일 오전 인천국제공항 제1여객터미널 신종 코로나바이러스 감염증(코로나19) 검사센터를 찾은 해외입국자가 검사를 받기 위해 이동하고 있다. 질병관리청 중앙방역대책본부(방대본)는 이날 0시 기준 신종... ,"Wed, 17 Aug 2022 12:56:00 +0900"
은행권 6월말 대출 연체율 0.20% '사상 최저'…'코로나 착시 효과',https://www.news1.kr/articles/4775317,https://n.news.naver.com/mnews/article/421/0006281986?sid=101,소상공인과 자영업자의 대출 원리금 만기를 연장하거나 상환을 유예해주는 '코로나 금융지원'에 따른... 2020년 4월부터 금융당국 주도로 실시된 소상공인·자영업자 대출 원리금 만기연장·상환유예 등 코로나... ,"Wed, 17 Aug 2022 12:00:00 +0900"
"美CDC, 러시아 '코로나 여행경보'…등급 4단계 중 3단계",http://www.newsis.com/view/?id=NISX20220817_0001980431&cID=10101&pID=10100,https://n.news.naver.com/mnews/article/003/0011366398?sid=104,"러시아를 코로나19로 인한 여행 경보 지역 목록에 올렸다. 16일(현지시간) 미국 CDC 홈페이지에 따르면 러시아는 코로나19 위험도 총 4단계 중 3단계, 위험도가 높은 지역으로 분류됐다. 4단계의 경우 '특별한 상황'으로... ","Wed, 17 Aug 2022 00:41:00 +0900"
코로나19 확진자 18만명…18주만 최고치,http://www.edaily.co.kr/news/newspath.asp?newsid=01453046632428304,https://n.news.naver.com/mnews/article/018/0005293795?sid=102,김성호 행정안전부 재난안전관리본부장(중대본차장)/사진=연합뉴스 17일 코로나19 신규 확진자 수는 약 18만... 이번주부터 수도권 상급종합병원에서는 주말에도 코로나19 중증병상이 운영된다. 김 2총괄조정관은... ,"Wed, 17 Aug 2022 08:35:00 +0900"
인천공항 신종 코로나 검사센터,https://www.news1.kr/photos/view/?5530885,https://n.news.naver.com/mnews/article/421/0006282091?sid=102,17일 오전 인천국제공항 제1여객터미널 신종 코로나바이러스 감염증(코로나19) 검사센터 앞으로 해외입국자들이 코로나19 검사를 위해 이동하고 있다. 질병관리청 중앙방역대책본부(방대본)는 이날 0시 기준... ,"Wed, 17 Aug 2022 12:56:00 +0900"
"""남편 이어"" 4차 접종 완료한 질 바이든 코로나19 확진",https://news.imaeil.com/page/view/2022081622385449258,https://n.news.naver.com/mnews/article/088/0000771070?sid=104,조 바이든 미국 대통령 부인 질 바이든 여사가 코로나바이러스감염증-19(코로나19) 확진 판정을 받았다고 16일(현지시간) CNN 등 외신들이 백악관을 인용해 보도했다. 이에 따르면 사우스캐롤라이나 주에서 휴가 일정을... ,"Tue, 16 Aug 2022 22:43:00 +0900"
"국회 찾은 빌 게이츠 ""한국, 코로나19 분야서 선도적 역할 하고 있어"" [뉴시스...",http://www.newsis.com/view/?id=NISX20220816_0001979622&cID=10301&pID=10300,https://n.news.naver.com/mnews/article/003/0011365260?sid=100,"전체회의장에서 '코로나19 및 미래감염병 대응·대비를 위한 국제공조 중요성과 대한민국의 리더십'을... 등 코로나19와 진단 검사 분야에서도 선도적인 역할을 하고 있다""고 밝혔다. 그는 ""제가 한국에 온 목적은 한국... ","Tue, 16 Aug 2022 13:05:00 +0900"
코로나 검사 받는 해외 입국자들,https://www.news1.kr/photos/view/?5530887,https://n.news.naver.com/mnews/article/421/0006282088?sid=102,17일 오전 인천국제공항 제1여객터미널 신종 코로나바이러스 감염증(코로나19) 검사센터에서 해외입국자들이 검체를 채취하고 있다. 질병관리청 중앙방역대책본부(방대본)는 이날 0시 기준 신종... ,"Wed, 17 Aug 2022 12:56:00 +0900"
추석승차권 예매 ‘먹통사태’에 분노 목소리…“코로나로 2년만인데 고향방문...,http://www.munhwa.com/news/view.html?no=2022081701039921081001,https://n.news.naver.com/mnews/article/021/0002526707?sid=102,올해는 코로나 19 영향으로 2년 넘게 고향 방문을 못 하다 이번 추석에 마음먹고 고향을 가려던 사람들이 많기 때문이다. 2년 넘게 고향을 못 간 직장인 손모(48) 씨는 “코로나19로 그간 고향을 못 가 부모님께... ,"Wed, 17 Aug 2022 08:46:00 +0900"
수도권에 '코로나 중증병상 주말 당직병원' 운영한다,https://www.news1.kr/articles/4774935,https://n.news.naver.com/mnews/article/421/0006281274?sid=102,정부가 신종 코로나바이러스 감염증(코로나19) 재유행 속에 위급환자가 주말·휴일 동안 진료를 받지 못하는 상황에 대처하기 위해 '중증병상 주말 당직병원'을 운영한다. 최근 집중호우로 피해지역 집단감염 우려가... ,"Wed, 17 Aug 2022 08:53:00 +0900"
"빌게이츠, 오늘 국회서 '코로나 국제공조' 연설",https://www.yna.co.kr/view/AKR20220815057200001?input=1195m,https://n.news.naver.com/mnews/article/001/0013376552?sid=100,게이츠 이사장은 이날 오전 10시 국회를 찾아 김진표 국회의장 등 주요 정치권 인사와 환담한 뒤 10시 40분부터 '코로나19 및 미래 감염병 대응·대비를 위한 국제공조의 중요성과 대한민국의 리더십'을 주제로 연설한다.... ,"Tue, 16 Aug 2022 05:31:00 +0900"
"코로나 신규 확진 18주만에 최고…중대본 ""중증병상 주말 당직병원 운영""",https://view.asiae.co.kr/article/2022081709205486578,https://n.news.naver.com/mnews/article/277/0005133657?sid=102,"코로나19 신규 확진자 수가 18주만에 최고 수준인 18만여명을 기록했다. 지난주 감염재생산지수가 1.18로 7주... 가운데 코로나19 신규 확진자 수가 18주 만에 최고치를 나타냈다""면서 ""위중증 환자 수는 469명, 사망자 수는... ","Wed, 17 Aug 2022 09:20:00 +0900"
"코로나 신규 확진자, 126일 만에 최고",https://www.news1.kr/photos/view/?5530892,https://n.news.naver.com/mnews/article/421/0006282083?sid=102,17일 오전 인천국제공항 제1여객터미널 신종 코로나바이러스 감염증(코로나19) 검사센터에서 해외입국자들이 코로나19 검사를 기다리고 있다. 질병관리청 중앙방역대책본부(방대본)는 이날 0시 기준 신종... ,"Wed, 17 Aug 2022 12:55:00 +0900"
"‘코로나19 예방접종 후 월경 이상’ 인과관계 인정, 최대 5000만원 지원",https://www.seoul.co.kr/news/newsView.php?id=20220816500193&wlog_tag3=naver,https://n.news.naver.com/mnews/article/081/0003294872?sid=102,"정부가 코로나19 백신접종과 이상자궁출혈(월경 이상) 간의 인과관계를 인정하고 피해보상 신청 시 심의를... 앞서 코로나19 백신안전성위원회는 국내·외 이상반응 사례, 자료 등을 종합적으로 분석한 결과 백신 접종... ","Tue, 16 Aug 2022 18:16:00 +0900"
코로나19 검사센터 찾은 해외 입국자들,https://www.news1.kr/photos/view/?5530889,https://n.news.naver.com/mnews/article/421/0006282086?sid=102,해외 입국자들이 17일 오전 인천국제공항 제1여객터미널 신종 코로나바이러스 감염증(코로나19) 검사센터로 이동을 하고 있다. 질병관리청 중앙방역대책본부(방대본)는 이날 0시 기준 신종 코로나바이러스... ,"Wed, 17 Aug 2022 12:56:00 +0900"
"완주군, 코로나19 재택치료 모니터링 취약계층 안전 도모",http://www.newsis.com/view/?id=NISX20220817_0001981032&cID=10808&pID=10800,https://n.news.naver.com/mnews/article/003/0011367262?sid=102,전북 완주군은 코로나19 재택치료 건강 모니터링을 통한 취약계층의 안전을 도모한다고 17일 밝혔다. 완주군은 코로나19 재택치료 집중관리군에 대한 건강모니터링이 중단됨에 따라 사각지대 틈을 줄이기 위해 재택치료... ,"Wed, 17 Aug 2022 11:26:00 +0900"
박형준 부산시장 코로나19 확진… 7일간 재택 치료,http://www.segye.com/content/html/2022/08/16/20220816503884.html?OutUrl=naver,https://n.news.naver.com/mnews/article/022/0003725381?sid=102,박형준 부산시장이 신종 코로나바이러스 감염증(코로나19) 확진 판정을 받고 7일간 재택 치료에 들어갔다. 16일 부산시에 따르면 박 시장은 전날 오전 실시한 PCR(유전자증폭) 검사에서 양성판정을 받았다. 박형준... ,"Tue, 16 Aug 2022 07:42:00 +0900"
"질 바이든 여사, 코로나19 확진…백악관 ""가벼운 증상""",http://www.busan.com/view/busan/view.php?code=2022081621085031269,https://n.news.naver.com/mnews/article/082/0001170000?sid=104,조 바이든 미국 대통령의 부인인 질 바이든 여사가 코로나19 검사에서 양성판정을 받았다고 16일(현지시간)... 앞서 바이든 대통령은 지난달 21일 코로나에 확진된 뒤 같은 달 27일 격리에서 해제됐으나 며칠 뒤 재발했다.... ,"Tue, 16 Aug 2022 23:17:00 +0900"
"질 바이든 여사, 코로나19 확진…백악관 ""가벼운 증상""",https://www.yna.co.kr/view/AKR20220816171800071?input=1195m,https://n.news.naver.com/mnews/article/001/0013379108?sid=104,지난달 감염 후 회복된 바이든은 '음성' 강병철 특파원 = 조 바이든 미국 대통령의 부인인 질 바이든 여사가 16일(현지시간) 신종 코로나바이러스 감염증(코로나19)에 걸렸다. 백악관은 이날 성명을 통해 바이든 여사가... ,"Tue, 16 Aug 2022 22:59:00 +0900"
