title,originallink,link,description,pubDate
음성군 코로나19 확산 방지 총력...4차 접종 독려,http://www.newspim.com/news/view/20220816000162,http://www.newspim.com/news/view/20220816000162, 충북 음성군이 코로나 확진자 증가에 따라 코로나19 예방과 확진자 관리에 나섰다. 16일 군에 따르면 이달 들어 일 평균 200여명이 추가되는 등 가파른 확산세가 지속되고 있다. 코로나19 검체 채취 모습[사진... ,"Tue, 16 Aug 2022 09:45:00 +0900"
"유민상, 코로나19 확진으로 '컬투쇼' 불참 ""자가격리 중""",http://www.joynews24.com/view/1511066,http://www.joynews24.com/view/1511066,방송인 유민상이 코로나19 확진됐다. 17일 방송된 SBS 라디오 파워FM '두시 탈출 컬투쇼'에서는 개그맨 유민상이 스페셜 DJ로 예정돼 있었으나 자리하지 못했다. 방송인 유민상이 코로나19 확진 판정으로 자가격리 중이다.... ,"Wed, 17 Aug 2022 14:26:00 +0900"
"코로나 확진자 광주 5521명, 전남 7509명 각각 발생",http://daily.hankooki.com/news/articleView.html?idxno=860808,http://daily.hankooki.com/news/articleView.html?idxno=860808,Covid19  광주와 전남에서 하루 사이 코로나19 확진자가 각각 5521명과 7509명 발생했다. 이로써... 광주는 전날 5521명이 코로나19 확진 판정을 받았다. 누적 확진자는 63만 1262명으로 늘었다. 광주는... ,"Wed, 17 Aug 2022 15:50:00 +0900"
"질 바이든, 코로나19 확진",https://news.koreadaily.com/2022/08/16/society/generalsociety/20220816210326438.html,https://news.koreadaily.com/2022/08/16/society/generalsociety/20220816210326438.html,조 바이든 대통령의 부인인 질 바이든(사진) 여사가 16일 신종 코로나바이러스 감염증(코로나19)에 걸렸다. 백악관은 이날 성명을 통해 바이든 여사가 코로나19 검사에서 양성판정을 받았다고 밝혔다. 바이든 여사는... ,"Wed, 17 Aug 2022 13:04:00 +0900"
코로나19 중대본 정례브리핑하는 박향 중앙사고수습본부 방역총괄반장,http://www.newsis.com/view/?id=NISI20220817_0019143559,https://n.news.naver.com/mnews/article/003/0011367442?sid=100,박향 중앙사고수습본부 방역총괄반장이 17일 오전 서울 종로구 정부서울청사에서 코로나19 중앙재난안전대책본부(중대본) 정례브리핑을 하고 있다. 2022.08.17. kmx1105@newsis.com 공감언론 뉴시스가 독자 여러분의... ,"Wed, 17 Aug 2022 12:03:00 +0900"
"'코로나 비상' 해제한 북한, 연이어 체육대회…""체육 대중화가 당의 방침""",https://www.news1.kr/articles/4775056,https://n.news.naver.com/mnews/article/421/0006281446?sid=102,지난주 신종 코로나바이러스 감염증(코로나19) 종식을 선언한 북한이 다양한 체육대회를 개최하면서 방역 전쟁에서의 승리를 과시하고 있다. 노동당 기관지 노동신문은 17일 '전국청소년태권도선수권대회'와... ,"Wed, 17 Aug 2022 10:01:00 +0900"
"중흥그룹, 코로나 극복 위한 헌혈 캠페인 실시",http://www.mediapen.com/news/view/746818,http://www.mediapen.com/news/view/746818,중흥그룹은 중흥건설 본사 앞에서 임직원이 동참하는 ‘코로나 극복을 위한 헌혈 캠페인’을 펼쳤다고 16일 밝혔다. 중흥그룹이 '코로나 극복을 위한 헌혈 캠페인'을 펼쳤다./사진=중흥그룹 이번 캠페인은 코로나 장기화로... ,"Tue, 16 Aug 2022 15:46:00 +0900"
'광복절연휴 끝 다시 북적이는 코로나19 선별검사소',https://www.news1.kr/photos/view/?5528518,https://n.news.naver.com/mnews/article/421/0006279177?sid=102,16일 오전 서울 용산구보건소 신종 코로나바이러스 감염증(코로나19) 선별진료소에서 시민들이 검사를 기다리고 있다. 질병관리청 중앙방역대책본부(방대본)는 이날 0시 기준 코로나19 신규 확진자가 8만4128명... ,"Tue, 16 Aug 2022 09:48:00 +0900"
"LG화학, 항체진단키트 美 FDA 승인 홍보 못한 사연은… “코로나 재확산 탓”",https://biz.chosun.com/it-science/bio-science/2022/08/17/H4BDEQGHVJCYPPT6MXTCOMYEXU/?utm_source=naver&utm_medium=original&utm_campaign=biz,https://n.news.naver.com/mnews/article/366/0000834777?sid=105,5월 제품 2종 美 FDA 긴급사용 승인 코로나19 면역 생겼는지 확인하는 용도 항체 면역 전수조사용으로 개발했는데 오미크론 BA.5 재유행으로 예측 불발 LG화학이 개발한 코로나19 항체진단키트가 지난 5월 미국... ,"Wed, 17 Aug 2022 14:57:00 +0900"
"독일, ‘코로나 살’로 뚱뚱해진 어린이들",https://news.kbs.co.kr/news/view.do?ncd=5534709&amp;ref=A,https://n.news.naver.com/mnews/article/056/0011322221?sid=104,최근 독일 어린이들이 점점 뚱뚱해지고 있는데 이른바 '코로나 살'이라는 분석입니다. 지난 2년 새 독일 어린이 6명 가운데 1명꼴로 체중이 급격히 증가했다는 조사 결과가 나왔습니다. 이른바 '코로나 살'이라는 것입니다.... ,"Wed, 17 Aug 2022 09:38:00 +0900"
코로나19 백신 접종 후 '월경장애' 이상반응 인과성 인정…최대 5000만원 지원,http://www.newspim.com/news/view/20220816001239,http://www.newspim.com/news/view/20220816001239," 코로나19 백신 접종 후 이상자궁출혈(빈발월경, 과다출혈월경) 등 월경 장애가 이상반응으로 인정됐다.... 앞서 지난 11일 코로나19 백신안전성위원회는 국내외 이상반응 사례, 자료 등을 분석한 결과 빈발월경·출혈... ","Tue, 16 Aug 2022 18:45:00 +0900"
'코로나19' 경북 16일 4261명 확진…포항 1044명,https://www.nocutnews.co.kr/news/5802169,https://n.news.naver.com/mnews/article/079/0003674897?sid=102,"경북은 16일 0시 기준 23개 시·군(시 10, 군 13)에서 코로나19 확진자 4261명이 발생했다. 시·군별... 경북지역 코로나19 백신 접종은 전체 도민 261만 6627명 가운데 1차 백신 접종률 87.6%(229만 2688명)... ","Tue, 16 Aug 2022 09:14:00 +0900"
코로나19 신규확진 18만명대…위중증 469명‧해외유입 567명,http://www.yakup.com/news/index.html?mode=view&cat=11&nid=272423,http://www.yakup.com/news/index.html?mode=view&cat=11&nid=272423,"코로나19 병상 보유량은 7,279병상으로, 가동률은 위중증 43.7%, 준-중증 61.1%, 중등증 44.5... 한편 코로나19 예방접종 대응 추진단은 이날 기준 신규 1차접종자가 519명, 2차접종자가 343명, 3차접종자 3,057명... ","Wed, 17 Aug 2022 10:12:00 +0900"
"경기 코로나19 신규 확진 2만1061명, 사망 4명",http://www.newsis.com/view/?id=NISX20220816_0001979442&cID=14001&pID=14000,https://n.news.naver.com/mnews/article/003/0011364751?sid=102,기사내용 요약 누적 확진자 581만9350명 경기도에서 코로나19 신규 확진자가 2만1061명 발생했다. 경기도에 따르면 16일 0시 기준 누적 확진자는 581만9350명이다. 하루 확진자 수는 전일(1만6087명)... ,"Tue, 16 Aug 2022 11:03:00 +0900"
"중흥그룹, '코로나 극복 헌혈 캠페인' 전개",http://www.constimes.co.kr/news/articleView.html?idxno=233529,http://www.constimes.co.kr/news/articleView.html?idxno=233529,"중흥그룹은 16일 중흥건설 본사 앞에서 임직원들이 동참한 '코로나 극복을 위한 헌혈 캠페인'을 펼쳤다고 밝혔다. 중흥건설 헌혈 참여자는 ""코로나 여파로 전국적으로 혈액 수급이 어려운 상황에 위급환자의 수혈이 막혀... ","Tue, 16 Aug 2022 13:38:00 +0900"
[특징주] 코로나19 진단키트 관련주 셀트리온 주가↑,https://www.gokorea.kr/news/articleView.html?idxno=728334,https://www.gokorea.kr/news/articleView.html?idxno=728334,사진 = 셀트리온 코로나19 진단키트 관련주 셀트리온 주가가 소폭 상승세를 보이고 있다. 16일 오전 9시 37분... 이는 지난 11일 미국 식품의약국(FDA)이 새로운 코로나19 자가진단키트 권고를 발표하며 자가진단키트 검사... ,"Tue, 16 Aug 2022 09:40:00 +0900"
제주 코로나 확진자 1391명…사망자 2명 추가,https://www.news1.kr/articles/4773941,https://n.news.naver.com/mnews/article/421/0006279595?sid=102,제주특별자치도는 지난 15일 코로나19 확진자가 1391명 발생해 누적수는 29만6963명으로 집계됐다고 16일 밝혔다. 제주 일일 확진자 수는 전날(14일 1473명)보다 82명 줄고 일주일전(8일 1656명)보다 265명 감소했다.... ,"Tue, 16 Aug 2022 11:17:00 +0900"
충북서 16일 오후 4시 코로나19 2522명…4월 9일 이후 최다,https://www.nocutnews.co.kr/news/5802803,https://n.news.naver.com/mnews/article/079/0003675345?sid=102,충북에서 16일 새벽 0시부터 오후 4시까지 코로나19 확진자 2522명이 새롭게 발생했다. 지난 4월 9일 이후... 충청북도 재난안전대책본부는 이날 오후 4시 기준으로 도내 11개 전 시군에서 모두 2522명이 코로나19... ,"Tue, 16 Aug 2022 18:25:00 +0900"
"코로나19 확진자 18만명 넘었다...정부 ""주말 당직병원 운영""",https://hankookilbo.com/News/Read/A2022081709010000544?did=NA,https://n.news.naver.com/mnews/article/469/0000691971?sid=102,"17일 0시 기준 코로나19 신규확진자가 18만 명에 달하며 18주 만에 최고치를 기록했다. 위중증 환자 수는 469명, 사망자 수는 42명이다. 질병관리청 중앙방역대책본부는 이날 0시 기준 신규 확진자 수가 18만803명으로... ","Wed, 17 Aug 2022 09:05:00 +0900"
"백신 4번 맞은 화이자 CEO도 코로나 확진…""증상 매우 가벼워""",http://www.dt.co.kr/contents.html?article_no=2022081602109919002002&ref=naver,https://n.news.naver.com/mnews/article/029/0002749092?sid=104,미국 제약사 화이자의 앨버트 불라 최고경영자(CEO)가 코로나19 양성 판정을 받았다. 그는 4차 접종까지 모두 맞았는데도 최근 코로나19에 감염된 주요 인사 중 한 명이 됐다. 15일(현지시간) 회사 측에 따르면 불라 CEO는... ,"Tue, 16 Aug 2022 04:22:00 +0900"
"[코로나19]신규확진 18만803명, 어제의 2.1배로 급증…넉달 만에 최다",https://www.joongang.co.kr/article/25094871,https://n.news.naver.com/mnews/article/025/0003217178?sid=102,신종 코로나바이러스 감염증(코로나19) 재유행이 지속되는 가운데 17일 신규 확진자 수는 18만명대로 급증했다. 중앙방역대책본부는 이날 0시 기준으로 코로나19 확진자가 18만803명 늘어 누적 2168만2816명이... ,"Wed, 17 Aug 2022 09:31:00 +0900"
수능 원서접수 18일부터…코로나 확진자 대리접수 가능,https://www.dnews.co.kr/uhtml/view.jsp?idxno=202208161329502810227,https://www.dnews.co.kr/uhtml/view.jsp?idxno=202208161329502810227,"코로나19 확진자와 장애인 학생은 대리접수를 할 수 있다. 교육부는 오는 18일부터 다음달 2일까지... 다만, 코로나19 확진 등으로 격리 통보를 받은 수험생, 장애인(시험편의제공대상자), 수형자, 군 복무자, 입원 중인... ","Tue, 16 Aug 2022 15:02:00 +0900"
"코로나 백신 접종 후 '생리불순' 의심 사례, 이미 4000명이 신고했다",https://www.insight.co.kr/news/408136,https://www.insight.co.kr/news/408136,"= 코로나19 백신과 '이상자궁출혈' 간의 인과성이 있는 것으로 나타난 가운데 현재까지 국내에서 해당 의심 사례가 4000건 가까이 신고된 것으로 드러났다.지난 11일 코로나19백신안정성위원회는 이상자궁출혈, 혈전... ","Tue, 16 Aug 2022 13:58:00 +0900"
코로나 회복 시급하다더니…작년 추경 집행률은 90%대 초반 그쳐,http://www.edaily.co.kr/news/newspath.asp?newsid=02886406632428304,https://n.news.naver.com/mnews/article/018/0005294208?sid=101,지난해 코로나19 피해 회복을 위해 두 차례 편성한 추가경정예산(추경)의 집행률이 90% 초반대에 머무른... (사진= 연합뉴스) 17일 국회예산정책처가 발표한 ‘2021 회계연도 결산’에 따르면 작년에는 코로나19 확산에... ,"Wed, 17 Aug 2022 14:11:00 +0900"
"""기업 출장, 2026년 돼야 코로나 이전 수준 회복""",http://www.wowtv.co.kr/NewsCenter/News/Read?articleId=A202208160053&t=NN,https://n.news.naver.com/mnews/article/215/0001048609?sid=101,전 세계적으로 기업 출장비 규모가 2026년은 돼야 코로나19 이전 수준으로 회복할 것이란 전망이 나왔다.... GBTA에 따르면 코로나19 발생 이전인 2019년 글로벌 업무 출장비 규모는 1조4천310억 달러(약 1천877조원)... ,"Tue, 16 Aug 2022 09:09:00 +0900"
‘코로나 살’로 뚱뚱해진 독일 어린이들,https://news.kbs.co.kr/news/view.do?ncd=5534956&amp;ref=A,https://n.news.naver.com/mnews/article/056/0011322375?sid=104,최근 독일 어린이들이 점점 뚱뚱해지고 있는데 이른바 '코로나 살'이라는 분석입니다. 지난 2년 새 독일 어린이 6명 가운데 1명꼴로 체중이 급격히 증가했다는 조사 결과가 나왔습니다. 이른바 '코로나 살'이라는 것입니다.... ,"Wed, 17 Aug 2022 12:55:00 +0900"
"홍지민, 코로나19 확진 ""나만 안 걸려서 신기했는데..""",http://star.mt.co.kr/stview.php?no=2022081608043050999,https://n.news.naver.com/mnews/article/108/0003079118?sid=106,"뮤지컬배우 홍지민이 신종 코로나바이러스 감염증(코로나19)에 확진됐다. 홍지민은 16일 자신의 인스타그램에 ""온가족이 다 걸렸는데도 저만 안걸려서 신기했죠. 그땐 계속 공연중이였으니 너무 다행이였죠. 지금은... ","Tue, 16 Aug 2022 08:10:00 +0900"
"학산면 새마을협의회, 코로나19에도 변함없는 이웃사랑 '눈길'",https://www.ccdailynews.com/news/articleView.html?idxno=2148677,https://www.ccdailynews.com/news/articleView.html?idxno=2148677,"충북 영동군 학산면새마을지도자협의회가 코로나19와 무더위 속에서도 변함없는 나눔과 봉사활동으로... 장두석·설재분 회장은 ""무더위와 코로나19 감염병 재확산으로 힘든 시기에도 불구하고 봉사에 적극 참여해 준... ","Wed, 17 Aug 2022 15:08:00 +0900"
"화이자 CEO, 백신 4번 접종하고도 코로나 확진",https://www.insight.co.kr/news/408121,https://www.insight.co.kr/news/408121,"= 코로나19 백신 최대 생산 기업인 미국 제약사 화이자의 앨버트 불라 최고경영자(CEO)가 결국 코로나19 양성 판정을 받았다.지난 15일(현지 시간) 불라 CEO는 이날 성명에서 코로나19에 확진됐다고 밝혔다.그는 ""화이자... ","Tue, 16 Aug 2022 11:14:00 +0900"
"소녀시대 수영, 코로나19 후유증 고백…""꽃향기 못 맡아 슬퍼""",https://www.news1.kr/articles/4774737,https://n.news.naver.com/mnews/article/421/0006281005?sid=106,"수영이 코로나19 후유증을 고백했다. 16일 오후 방송된 JTBC 예능 프로그램 '소시탐탐'에서 소녀시대 멤버... 수영은 ""나 코로나 걸린 뒤에 후각이 없어졌나 봐""라며 ""진짜 (향이) 안 나서 너무 슬퍼""라고 털어놨다. 또 윤아를... ","Tue, 16 Aug 2022 21:30:00 +0900"
오후 9시까지 코로나 5만9790명 확진… 전주의 1.12배,https://biz.chosun.com/topics/topics_social/2022/08/14/RU3FZ45RSFCFPAISF6PGARUJXQ/?utm_source=naver&utm_medium=original&utm_campaign=biz,https://n.news.naver.com/mnews/article/366/0000834135?sid=102,가까운 코로나19 신규 확진자가 발생했다. 서울시 등 각 지방자치단체에 따르면 이날 0시부터 오후 9시까지 전국 17개 시도에서 코로나19 확진 판정을 받은 사람은 5만9790명으로 집계됐다. 전날 동시간대... ,"Sun, 14 Aug 2022 21:55:00 +0900"
대만 코로나 신규 2만3172명·총 492만7754명...16명 숨져,http://www.newsis.com/view/?id=NISX20220816_0001980012&cID=10101&pID=10100,https://n.news.naver.com/mnews/article/003/0011365875?sid=104,"오미크론 변이와 하위변이를 중심으로 코로나19가 퍼지는 대만에서 16일 신규환자가... 중앙통신과 연합보(聯合報), 중국시보(中國時報) 등에 따르면 코로나19 대책본부인 중앙유행병... ","Tue, 16 Aug 2022 15:57:00 +0900"
"[포토] 빌 게이츠, '코로나19 국제공조' 국회 연설",http://www.segye.com/content/html/2022/08/16/20220816512242.html?OutUrl=naver,https://n.news.naver.com/mnews/article/022/0003725475?sid=100,코로나19 및 미래 감영병 대응·대비를 위한 국제공조의 중요성과 대한민국의 리더십'을 주제로 한 연설을 하고 있다. 빌 게이츠 빌 앤 멜린다 게이츠 재단 공동 이사장이 16일 오전 서울 여의도 국회에서 '코로나19 및 미래... ,"Tue, 16 Aug 2022 13:24:00 +0900"
"코로나 시대, 감기약 생산 쉴 새 없다…대원제약 상반기 생산 '최대'",https://www.news1.kr/articles/4774670,https://n.news.naver.com/mnews/article/421/0006281118?sid=101,"대원제약이 신종 코로나바이러스 감염증(코로나19) 대증 치료에 사용하는 감기약, 호흡기 치료제 수요 대응으로 인해 상반기 최대 생산실적을 기록한 것으로 나타났다. 17일 금융감독원 전자공시시스템에 따르면... ","Wed, 17 Aug 2022 06:03:00 +0900"
日 코로나19 확진 16만6025명…전날보다 3만명 늘어,https://www.news1.kr/articles/4774759,https://n.news.naver.com/mnews/article/421/0006280968?sid=104,16일 오후 7시 기준 일본 신종 코로나바이러스 감염증(코로나19) 신규 확진자수가 16만6025명으로 집계됐다고 일본 공영 NHK가 보도했다. 이날 확진자는 전난 13만8613명보다 3만 명 가량 늘었다. 다만 12일... ,"Tue, 16 Aug 2022 20:28:00 +0900"
"""코로나 환자에 '세균감염 확인 전 항생제 처방' 큰 이득 없다""",https://biz.sbs.co.kr/article_hub/20000076360?division=NAVER,https://n.news.naver.com/mnews/article/374/0000298914?sid=101,임상 현장에서 코로나19 환자에게 세균 감염에 대한 검사 결과가 나오기도 전에 항생제를 처방하는 경우가... 중등도·중증 코로나 환자 233명을 대상으로 '경험적 항생제 치료'가 임상 결과를 개선할 수 있는지 분석해... ,"Tue, 16 Aug 2022 11:01:00 +0900"
코로나 확진 수험생은 대리접수… 세종 등 4곳 온라인 가능,http://www.fnnews.com/news/202208161808173030,https://n.news.naver.com/mnews/article/014/0004883971?sid=102,"코로나19에 확진된 수험생은 학부모 등이 대리접수할 수 있으며, 세종·충남·대전·충북 등 4개 지역에선... 대리접수가 가능한 대상자는 코로나19 확진 등으로 방역당국으로부터 격리통보를 받은 수험생, 장애인... ","Tue, 16 Aug 2022 18:09:00 +0900"
"황치열 ""메타버스 예능 '아바타 싱어' 출연"", 김태균 ""유민상, 코로나로 격리...",http://enews.imbc.com/News/RetrieveNewsInfo/357113,https://n.news.naver.com/mnews/article/408/0000164414?sid=106,"이후 김태균이 ""원래 오늘은 유민상 씨가 스페셜 DJ를 하시는 날인데 유민상 씨가 코로나 바이러스와 싸우고 있다. 일주일 격리를 하고 있어 다음 주에 만날 수 있을 것 같다""라고 유민상의 근황을 전하고 ""'컬투쇼... ","Wed, 17 Aug 2022 14:49:00 +0900"
"질 바이든 여사, 코로나19 확진…가벼운 증상",http://www.newsworks.co.kr/news/articleView.html?idxno=606317,http://www.newsworks.co.kr/news/articleView.html?idxno=606317, 조 바이든 미국 대통령의 부인 질 바이든(71) 여사가 코로나19에 확진됐다. 16일(현지시간) 로이터통신 등에 따르면 이날 바이든 여사 측 엘리자베스 알렉산더 공보국장은 바이든 여사가 코로나19 양성판정을 받았다고... ,"Wed, 17 Aug 2022 10:12:00 +0900"
"코로나 이겨낸 숙박 스타트업 '온다', 상반기 거래액 1000억 돌파",http://news.mt.co.kr/mtview.php?no=2022081616182344288,https://n.news.naver.com/mnews/article/008/0004783576?sid=101,호텔·숙박용 서비스형 소프트웨어(SaaS)를 운영하는 B2B 플랫폼 스타트업 온다(ONDA)가 올해 상반기 1070억원의 거래액을 기록했다고 16일 밝혔다. 전년동기 대비 약 100% 상승한 수치다. 지난해 전체 거래액이 1000억원... ,"Tue, 16 Aug 2022 16:53:00 +0900"
"""코로나 정점, 기존 예측대로 20만 명 전후 예상""",https://kormedi.com/?p=1414253,https://n.news.naver.com/mnews/article/296/0000058332?sid=103,이번 코로나19 유행 정점은 하루 20만 명 전후가 될 것으로 보인다. 중앙방역대책본부는 16일 최근 유행 상황을 반영한 '코로나19 유행 예측' 결과를 발표했다. 모델링 전문가들의 진단에 의하면 원래 정부가 예측한... ,"Tue, 16 Aug 2022 14:51:00 +0900"
15일 하루 경남에 코로나19 확진자 5569명 발생,http://www.busan.com/view/busan/view.php?code=2022081610151860377,https://n.news.naver.com/mnews/article/082/0001169797?sid=102,15일 하루 경남에서 코로나19 확진자 5569명이 발생했다. 경남도는 16일 오전 10시 코로나19 발생과 대응관련 브리핑 자료를 통해 15일 하루 신규 확진자 5569명이 발생했다고 밝혔다. 이들은 도내 거주자... ,"Tue, 16 Aug 2022 10:16:00 +0900"
"美 퍼스트 레이디 질 바이든 여사, 코로나19 확진",https://www.news1.kr/articles/4774803,https://n.news.naver.com/mnews/article/421/0006281023?sid=104,= 조 바이든 미국 대통령의 부인 질 바이든 여사가 신종 코로나바이러스 감염증(코로나19) 검사에서 양성 판정을 받았다고 로이터통신이 16일(현지시간) 보도했다.,"Tue, 16 Aug 2022 22:34:00 +0900"
"대한항공, 내달부터 일등석 확대… 코로나 이후 2년만",https://www.chosun.com/economy/industry-company/2022/08/17/2AOREBJJUBDOJABRILACJ2GV4U/?utm_source=naver&utm_medium=referral&utm_campaign=naver-news,https://n.news.naver.com/mnews/article/023/0003710297?sid=101,"대한항공은 2020년 6월 코로나 팬데믹으로 여객 수요가 급감하자 미국 뉴욕과 LA 노선을 제외하고, 다른 노선의 일등석 운영을 전면 중단했다. 코로나 방역 때문에 기내 서비스 제공이 어렵다는 점 등을 감안한 조치였다.... ","Wed, 17 Aug 2022 03:02:00 +0900"
"칠레 이스터 섬, ‘코로나로 얻은 교훈’",https://news.kbs.co.kr/news/view.do?ncd=5534716&amp;ref=A,https://n.news.naver.com/mnews/article/056/0011322224?sid=104,"그러나 코로나로 2020년 3월부터 하늘길이 끊기면서 이스터의 관광산업은 거의 전멸했습니다. [올가/라파 누이 공예가 : ""우리에겐 바람 말고는 아무것도 남지 않게 되었어요. 그래서 우리는 경작을 시작했습니다. 그것이... ","Wed, 17 Aug 2022 09:41:00 +0900"
"현대바이오 ""범용 항바이러스제, 코로나 임상 속도 붙었다""",https://it.chosun.com/site/data/html_dir/2022/08/16/2022081600820.html,https://it.chosun.com/site/data/html_dir/2022/08/16/2022081600820.html,코로나19 치료제의 임상 진행 속도가 7월 개최된 DSMB(데이터안전성모니터링위원회) 이후 눈에 띄게 빨라졌다고 16일 밝혔다. 현대바이오에 따르면 자사의 범용 항바이러스제 후보물질인 ‘CP-COV03’의 코로나19... ,"Tue, 16 Aug 2022 09:16:00 +0900"
"日, 코로나 '계절독감' 취급 검토…확진자 전수 조사 중단할 듯",https://www.news1.kr/articles/4774303,https://n.news.naver.com/mnews/article/421/0006280499?sid=104,일본 정부가 코로나19를 2급 감염병에서 계절 독감 같은 5급 감염병으로 하향하는 방안을 검토 중인 것으로... 요미우리신문에 따르면 기시다 후미오 일본 총리는 전날(15일) 고토 시게유키 후생노동상 등과 가진 코로나19... ,"Tue, 16 Aug 2022 15:31:00 +0900"
끝이 안보이는 코로나19,https://www.dailian.co.kr/news/view/1143326/?sc=Naver,https://n.news.naver.com/mnews/article/119/0002630836?sid=102,코로나19 신규 확진자 수가 18만803명으로 집계된 17일 서울 마포구 코로나19 마포구보건소 선별검사소에서 시민들이 코로나19 검사를 위해 줄을 서서 기다리고 있다.,"Wed, 17 Aug 2022 09:51:00 +0900"
'오미크론 백신' 세계 첫 승인...'코로나 백신' 2세대 개막,https://science.ytn.co.kr/program/program_view.php?s_mcd=0082&s_hcd=&key=202208161147069775,https://science.ytn.co.kr/program/program_view.php?s_mcd=0082&s_hcd=&key=202208161147069775,새 백신은 오미크론 변이는 물론 기존 코로나19 바이러스에도 대응하는 이른바 '2가 백신'으로 코로나19 백신 2세대의 막이 열렸다는 평가입니다. 보도에 김상우 기자입니다. 올해 1월 남아프리카공화국에서 오미크론의... ,"Tue, 16 Aug 2022 12:16:00 +0900"
코로나19 재유행 감기약 줄줄이 가격 인상,http://www.munhwa.com/news/view.html?no=2022081501039910293003,https://n.news.naver.com/mnews/article/021/0002526467?sid=102,"광동제약‘쌍화탕’ 이달 10∼20% 올라…‘콜대원’도 검토 중…판피린 10월 인상 예고 코로나19 유행 양상이... 콜대원은 어린 자녀를 둔 부모들을 중심으로 수요가 많은 감기약으로, 코로나19 오미크론 변이가 대규모로... ","Mon, 15 Aug 2022 09:41:00 +0900"
