title,originallink,link,description,pubDate
[포토] 코로나19 신규확진 18만803명···18주새 최다치,https://view.asiae.co.kr/article/2022081709520108713,https://n.news.naver.com/mnews/article/277/0005133705?sid=102,코로나19 신규 확진자가 18만명대로 급증한 17일 서울 송파구보건소 선별진료소에서 시민들이 검사를 위해 대기하고 있다. 중앙방역대책본부는 이날 0시 기준 코로나19 신규 확진자가 18만803명이라고 밝혔다.... ,"Wed, 17 Aug 2022 09:52:00 +0900"
"박형준 부산시장, 코로나19 확진…일주일 재택 치료",http://www.segye.com/content/html/2022/08/15/20220815509547.html?OutUrl=naver,https://n.news.naver.com/mnews/article/022/0003725201?sid=102,"부산시는 15일 박형준 시장이 유전자증폭(PCR) 검사에서 신종 코로나바이러스 감염증(코로나19) 양성 판정을 받았다고 밝혔다. 박형준 부산시장. 공동취재사진 이에 따라 박 시장은 외부 일정을 모두 취소하고, 21일까지... ","Mon, 15 Aug 2022 13:57:00 +0900"
[속보] 코로나 위중증 469명… 하루 사망자 42명,http://moneys.mt.co.kr/news/mwView.php?no=2022081708571187482,https://n.news.naver.com/mnews/article/417/0000843412?sid=102,코로나 위중증 469명… 하루 사망자 42명,"Wed, 17 Aug 2022 09:30:00 +0900"
"이달 중 코로나 정점 찍는다…""확진 20만 명, 위중증 900명대 가능성""",http://www.sisajournal.com/news/articleView.html?idxno=244405,https://n.news.naver.com/mnews/article/586/0000043308?sid=102,"8개 전문가 연구팀 예측값 종합한 전망 백경란 ""변동 가능성 커 지속 관찰 필요"" 정부가 코로나19 재유행... 백경란 질병관리청장은 16일 코로나19 정례 브리핑을 통해 ""전문가들이 최근 유행 상황을 반영해 예측한... ","Tue, 16 Aug 2022 13:31:00 +0900"
"호산대, 코로나19 이후 첫 전문대학 글로벌현장학습 발대식",http://www.kyongbuk.co.kr/news/articleView.html?idxno=2109839,http://www.kyongbuk.co.kr/news/articleView.html?idxno=2109839,호산대는 최근 '2022년도 전문대학 글로벌 현장학습' 발대식을 가졌다. 선발된 학생은 오는 9월부터 3개월간 미국 위트 대학에서 현장실습을 갖는다.호산대. 호산대학교(김재현 총장)는 최근(지난 9일) '2022년도... ,"Wed, 17 Aug 2022 15:28:00 +0900"
"괴산군, 코로나19 재택치료 고위험군 자체 건강모니터링 실시",https://www.gukjenews.com/news/articleView.html?idxno=2529445,https://www.gukjenews.com/news/articleView.html?idxno=2529445,충북 괴산군은 코로나19 재택치료 고위험군에 대한 자체 건강모니터링을 운영한다고 16일 밝혔다. 재택치료... 있도록 코로나19 고위험군 재택치료자에 대한 자체 건강모니터링을 실시한다. 건강모니터링 대상은... ,"Tue, 16 Aug 2022 08:54:00 +0900"
"끝 안보이는 코로나…""켄타우로스 못 막으면 재감염 폭증""",https://www.sedaily.com/NewsView/269TLHKWYW,https://n.news.naver.com/mnews/article/011/0004088190?sid=103,현재 국내 코로나19 우세종인 BA.5 변이에 걸렸다가 완치됐더라도 일명 ‘켄타우로스’로 불리는 BA.2.75... 현재 국내 코로나19 재감염률은 5~6% 수준이다. 이에 대해 사토 교수는 “변이 전환이 진행됨에 따라 현재의... ,"Tue, 16 Aug 2022 20:01:00 +0900"
"코로나19 확진자 18만명, 넉달여만에 최다",http://www.newsis.com/view/?id=NISI20220817_0019142909,https://n.news.naver.com/mnews/article/003/0011366772?sid=102,코로나19 하루 확진자 수가 126일만에 최다인 18만803명을 기록한 17일 오전 서울 동작구 동작구보건소 선별진료소에서 시민들이 검사받고 있다. 2022.08.17 kgb@newsis.com 공감언론 뉴시스가 독자 여러분의 소중한... ,"Wed, 17 Aug 2022 09:57:00 +0900"
"구례군, 고위험군 코로나19 4차 접종 참여 당부",https://www.jnilbo.com/view/media/view?code=2022081616340831927,https://www.jnilbo.com/view/media/view?code=2022081616340831927,"구례군은 최근 여름철 휴가 기간 동안 '깜깜이 감염', '집단감염' 등 코로나19의 재유행에 대비해, 중증... 김순호 구례군수는 ""본격적인 여름 휴가철을 맞아 코로나19 확산이 우려되는 상황인 만큼, 집단감염에 대비해... ","Tue, 16 Aug 2022 16:58:00 +0900"
"코로나19 확진자 18만명, 넉달여만에 최다",http://www.newsis.com/view/?id=NISI20220817_0019142917,https://n.news.naver.com/mnews/article/003/0011366771?sid=102,코로나19 하루 확진자 수가 126일만에 최다인 18만803명을 기록한 17일 오전 서울 동작구 동작구보건소 선별진료소에서 시민들이 검사받기 위해 기다리고 있다. 2022.08.17 kgb@newsis.com 공감언론 뉴시스가 독자... ,"Wed, 17 Aug 2022 09:57:00 +0900"
"경북신보, 코로나19 이후 보증지원 급증",https://news.kbs.co.kr/news/view.do?ncd=5533589&amp;ref=A,https://n.news.naver.com/mnews/article/056/0011321336?sid=101,"코로나19 기간 경북 신용보증재단의 보증 지원이 큰 폭으로 확대됐습니다. 경북신보는 최근 3년간 신규... 또 최근 출연금 유치 확대와 3무 특례보증, 신속심사팀 운영 등으로, 코로나19로 어려움에 처한 지역 소기업과... ","Tue, 16 Aug 2022 08:14:00 +0900"
화천군 50세 이상 주민 코로나19 백신 4차 접종,http://www.kukinews.com/newsView/kuk202208160048,http://www.kukinews.com/newsView/kuk202208160048,사진=쿠키뉴스 DB 강원 화천군이 지역 내 50세 이상 군민들의 코로나19 4차 접종을 이달부터 본격적으로 추진 중이다. 군은 50세 이상 군민 중 3차 접종 완료자를 대상으로 지난 1일부터 지역 내 병·의원 등 접종위탁... ,"Tue, 16 Aug 2022 10:50:00 +0900"
코로나19 재확산에 붐비는 선별검사소,http://www.newspim.com/news/view/20220817000667,http://www.newspim.com/news/view/20220817000667,= 코로나19 재확산 여파로 신규 확진자 수가 18주 만에 18만 명대로 집계된 17일 오후 서울 중구 서울역... 중앙방역대책본부는 이날 0시 기준 코로나19 신규 확진자가 18만803명이라고 밝혔다. 위중증 환자는... ,"Wed, 17 Aug 2022 13:45:00 +0900"
"코로나 신규확진 12만4592명, 사망자 97일만에 최다",https://news.kmib.co.kr/article/view.asp?arcid=0017370133&code=61121111&cp=nv,https://n.news.naver.com/mnews/article/005/0001546225?sid=102,코로나19 신규 확진자 수가 전날보다 4000여명 감소했지만 여전히 12만명대를 기록했다. 중앙방역대책본부는 13일 0시 기준으로 코로나19 확진자가 12만4592명 늘어 누적 2123만6355명이 됐다고 밝혔다.... ,"Sat, 13 Aug 2022 10:00:00 +0900"
"경기도, 이재민 임시거주시설 코로나 방역 강화",https://view.asiae.co.kr/article/2022081610140852378,https://n.news.naver.com/mnews/article/277/0005133072?sid=102,"경기도가 집중호우 이재민 임시주거시설에서 코로나 확진자가 발생함에 따라 대책을 마련, 시행에 들어갔다. 16일 경기도에 따르면 지난 14일 안양시의 한 임시주거시설에 수용된 30대 남성 1명이 코로나19 감염... ","Tue, 16 Aug 2022 10:14:00 +0900"
"질 바이든 여사, 코로나19 확진…""가벼운 증상""",http://www.yonhapnewstv.co.kr/MYH20220817004300038/?input=1825m,https://n.news.naver.com/mnews/article/422/0000556165?sid=104,"조 바이든 미국 대통령의 부인 질 바이든 여사가 현지시간 16일, 코로나19 검사에서 양성판정을 받았다고... 앞서 바이든 대통령은 지난달 21일 코로나에 확진됐다가 며칠 후 재발했고, 지난 7일 2차례 음성판정을 받은 뒤... ","Wed, 17 Aug 2022 08:45:00 +0900"
일본 코로나 '계절 독감'처럼 취급할까…'전수조사' 중지 검토,https://news.jtbc.co.kr/article/article.aspx?news_id=NB12070990,https://n.news.naver.com/mnews/article/437/0000310019?sid=104,코로나 19 환자가 급증하고 있는 일본이 '전수 조사' 중지를 검토하고 나섰습니다. 환자가 발생할 때마다... 16일 요미우리신문에 따르면 기시다 후미오 일본 총리는 후생노동성에 코로나 19 확진자를 확인하는 '전수 조사... ,"Tue, 16 Aug 2022 15:28:00 +0900"
"""확진자 789% 증가""…'코로나 청정국' 마셜제도, 재난사태 선포",https://view.asiae.co.kr/article/2022081521491922626,https://n.news.naver.com/mnews/article/277/0005132885?sid=104,코로나19 청정 지역이던 태평양의 섬나라 마셜 제도마저 바이러스의 직격탄을 맞게 됐다. 15일(현지시간) 국제 통계 사이트인 월드오미터에 따르면 전날 마셸제도의 코로나19 신규 확진자 수는 569명으로 집계됐다.... ,"Tue, 16 Aug 2022 03:00:00 +0900"
"'도성수♥' 홍지민, 결국 코로나19 확진 ""나만 안 걸려 신기했는데""",http://www.mydaily.co.kr/new_yk/html/read.php?newsid=202208160856985030&ext=na&utm_campaign=naver_news&utm_source=naver&utm_medium=related_news,https://n.news.naver.com/mnews/article/117/0003636039?sid=106,"뮤지컬 배우 홍지민(49)이 코로나19 확진 판정을 받았다. 홍지민은 16일 자신의 인스타그램에 ""온 가족이 다... 공개된 사진에는 홍지민이 사용한 코로나19 자가검사 키트가 담겼다. 코로나19 자가검사 키트는 대조선(C)과... ","Tue, 16 Aug 2022 09:03:00 +0900"
코로나19 신규 확진 18만명 안팎… 넉달새 최다,https://www.ebn.co.kr/news/view/1542714/?sc=Naver,https://www.ebn.co.kr/news/view/1542714/?sc=Naver,코로나19 신규 확진자 수가 18만명 안팎으로 넉달새 최다치를 기록할 전망이다. 17일 서울시 등 각 지방자치단체에 따르면 전날 0시부터 오후 9시까지 전국 17개 시도에서 코로나19 확진 판정을 받은 사람은... ,"Wed, 17 Aug 2022 08:48:00 +0900"
"중흥그룹 본사 임직원, ‘코로나 극복을 위한 헌혈 캠페인’ 동참",http://www.fntimes.com/html/view.php?ud=2022081616443595775e6e69892f_18,http://www.fntimes.com/html/view.php?ud=2022081616443595775e6e69892f_18,중흥그룹은 16일 중흥건설 본사 앞에서 임직원들이 동참하는 ‘코로나 극복을 위한 헌혈 캠페인’을 펼쳤다. 이번 헌혈 캠페인은 코로나 장기화로 국내 혈액보유량이 최저수준인 상황에 중흥그룹 임직원들의 자발적인... ,"Tue, 16 Aug 2022 16:46:00 +0900"
"'사직 할아버지' 외국인 롯데 팬 마허 교수, 코로나19 합병증으로 별세",http://www.newstomato.com/ReadNews.aspx?no=1141495&inflow=N,http://www.newstomato.com/ReadNews.aspx?no=1141495&inflow=N,뉴스토마토 = 박창욱 기자 | 케리 마허 전 영산대 교수 한국에 정착한 후 14년 동안 롯데 자이언츠 팬으로 이름을 알렸던 부산 사직구장의 '마스코트' 케리 마허 전 영산대 교수가 신종 코로나바이러스 감염증(코로나19)... ,"Wed, 17 Aug 2022 12:02:00 +0900"
"코로나19 신규 확진 180,803명, 넉 달 만에 최대치",http://tbs.seoul.kr/news/newsView.do?typ_800=6&idx_800=3476167&seq_800=20468833,http://tbs.seoul.kr/news/newsView.do?typ_800=6&idx_800=3476167&seq_800=20468833,코로나19 재유행이 정점을 향해 가면서 오늘 신규 확진자 수는 넉 달 만에 최대치인 18만 명대를 기록했습니다. 중앙방역대책본부는 오늘(17일) 0시 기준 코로나19 신규 확진자 수가 18만 803명으로 집계됐다고... ,"Wed, 17 Aug 2022 09:42:00 +0900"
"충주시보건소, 찾아가는 코로나19 접종",http://www.dynews.co.kr/news/articleView.html?idxno=669545,http://www.dynews.co.kr/news/articleView.html?idxno=669545,［동양일보 윤규상 기자］충주시보건소가 23일까지 의료취약지 보건진료소 16곳에서 '찾아가는 코로나19 4차 방문 접종'을 추진한다. 이번 방문접종은 코로나19 재유행에 대비해 의료취약지역 고위험군의 중증과... ,"Tue, 16 Aug 2022 12:36:00 +0900"
"음성군, 코로나 방역 고삐 다시 죈다",https://www.inews365.com/news/article.html?no=727409,https://www.inews365.com/news/article.html?no=727409,최근 코로나19 확진자가 증가함에 따라 감염 예방과 확진자 관리 등 방역의 고삐를 다시 죈다. 16일 군에 따르면 이달들어 하루 평균 200여 명이 코로나에 확진되는 등 가파른 확산세가 계속되고 있다. 지금까지 누적... ,"Tue, 16 Aug 2022 10:46:00 +0900"
"뮤지컬 배우 홍지민, 코로나19 확진…""슬기로운 격리 생활""",http://www.inews24.com/view/1510502,https://n.news.naver.com/mnews/article/031/0000691850?sid=106,"뮤지컬 배우 홍지민이 신종 코로나바이러스 감염증(코로나19)에 확진됐다. 홍지민은 16일 자신의 사회관계망서비스(SNS)에 ""온 가족이 다 걸렸는데도 저만 안 걸려서 신기했었다""라는 말과 함께 코로나19 양성 반응이 나온... ","Tue, 16 Aug 2022 09:50:00 +0900"
이번 주 코로나 일평균 10만중반대 전망,http://www.naeil.com/news_view/?id_art=432691,http://www.naeil.com/news_view/?id_art=432691,12만명대 코로나19 확진자가 발생한 가운데 이번주 일평균 확진자가 10만명 중반대로 발생할 것으로... 15일 중앙방역대책본부에 따르면 지난주 코로나19 일평균 신규확진자는 12만3876명이 발생했다. 지지난주(7월 31일... ,"Tue, 16 Aug 2022 12:20:00 +0900"
코로나19 재확산 속 붐비는 선별검사소,http://www.newspim.com/news/view/20220817000665,http://www.newspim.com/news/view/20220817000665,= 코로나19 재확산 여파로 신규 확진자 수가 18주 만에 18만 명대로 집계된 17일 오후 서울 중구 서울역... 중앙방역대책본부는 이날 0시 기준 코로나19 신규 확진자가 18만803명이라고 밝혔다. 위중증 환자는... ,"Wed, 17 Aug 2022 13:45:00 +0900"
"코로나19 확진자 18만명 발생, 126일만에 최다",http://www.newsis.com/view/?id=NISI20220817_0019142913,https://n.news.naver.com/mnews/article/003/0011366770?sid=102,코로나19 하루 확진자 수가 126일만에 최다인 18만803명을 기록한 17일 오전 서울 동작구 동작구보건소 선별진료소에서 시민들이 검사받기 위해 기다리고 있다. 2022.08.17 kgb@newsis.com 공감언론 뉴시스가 독자... ,"Wed, 17 Aug 2022 09:57:00 +0900"
"씨젠, 코로나 특수 끝?…영업익 91% 급감에 증권가 전망도 깜깜",http://news.mt.co.kr/mtview.php?no=2022081614402642085,https://n.news.naver.com/mnews/article/008/0004783448?sid=101,코로나19(COVID-19) 특수를 누리던 씨젠이 휘청이고 있다. 방역 정책 변화 탓에 올 2분기 영업이익은 전년 동기 대비 91% 급감했다. 하반기 전망도 밝지 않다. 증권가에서는 씨젠이 코로나19가 아닌 새로운 성장동력을... ,"Tue, 16 Aug 2022 14:44:00 +0900"
집중호우 피해에 코로나 확산세까지…개학 코앞인데 어쩌나,https://www.news1.kr/articles/4771910,https://n.news.naver.com/mnews/article/421/0006277624?sid=102,"여름방학을 마치고 2학기 학사 일정을 시작하는 학교가 늘어나지만 집중호우, 신종 코로나바이러스 감염증(코로나19) 확산세 등 상황은 만만치 않다. 15일 교육부에 따르면 전국 대부분의 초·중·고등학교가 앞으로 2주... ","Mon, 15 Aug 2022 06:00:00 +0900"
"경험적 항생제 치료, 중증 코로나 환자 예후 영향 없어",http://www.bosa.co.kr/news/articleView.html?idxno=2179208,http://www.bosa.co.kr/news/articleView.html?idxno=2179208, 경험적 항생제 치료가 중등도·중증 코로나 환자의 입원기간이나 산소 치료기간을 단축시키지 못했을 뿐... 중등도·중증 코로나 환자 233명을 대상으로 경험적 항생제 치료가 임상 결과를 개선할 수 있는지 분석한... ,"Tue, 16 Aug 2022 10:44:00 +0900"
[포토] 코로나19 신규확진 18만명… 18주 만에 ‘최다’,https://view.asiae.co.kr/article/2022081709534032554,https://n.news.naver.com/mnews/article/277/0005133712?sid=102,코로나19 신규 확진자가 18만명대로 급증한 17일 서울 송파구보건소 선별진료소에서 시민들이 검사를 위해 대기하고 있다. 중앙방역대책본부는 이날 0시 기준 코로나19 신규 확진자가 18만803명이라고 밝혔다.... ,"Wed, 17 Aug 2022 09:53:00 +0900"
물난리에 코로나까지‥재난 덮친 구룡마을,https://imnews.imbc.com/replay/2022/nwtoday/article/6398461_35752.html,https://n.news.naver.com/mnews/article/214/0001215912?sid=102,"◀ 앵커 ▶ 폭우가 휩쓸고 간 마을들은 복구도 문제지만 코로나 악재까지 겹쳐 문제입니다. 백 명이 넘게 모였던 대피소에서는 코로나 확진자가 잇따라 나와, 물에 젖은 집으로 돌아가야 했습니다. 김현지 기자입니다.... ","Tue, 16 Aug 2022 07:36:00 +0900"
"웰스바이오, 교육청 코로나19 자가검사키트 신규 공급",http://www.yakup.com/news/index.html?mode=view&cat=12&nid=272398,http://www.yakup.com/news/index.html?mode=view&cat=12&nid=272398,자사의 코로나19 자가검사키트 ‘careUS COVID-19 Antigen Home Test’의 신규 공급 계약을 체결했다고 16일 밝혔다.... 통해 코로나19 바이러스의 감염 여부를 확인하기 위하여 보조적으로 사용하는 체외진단 의료기기다. 본... ,"Tue, 16 Aug 2022 16:44:00 +0900"
"충주시보건소, ‘찾아가는 코로나19 4차 방문 접종’ 실시",http://www.breaknews.com/916374,http://www.breaknews.com/916374,충주시보건소는 23일까지 의료취약지역 16개 보건진료소에서 ‘찾아가는 코로나19 4차 방문 접종’을 실시 중이라고 16일 밝혔다. 이번 방문 접종은 코로나19 재유행에... ,"Tue, 16 Aug 2022 17:54:00 +0900"
"박형준 부산시장, 코로나19 확진…7일간 재택치료",http://www.inews24.com/view/1510380,https://n.news.naver.com/mnews/article/031/0000691784?sid=102,"부산광역시는 박형준 부산시장이 15일 유전자증폭(PCR) 검사에서 신종 코로나바이러스 감염증(코로나19) 양성판정을 받았다고 밝혔다. 박형준 시장은 코로나19 확진에 따라 외부 일정을 모두 취소했고, 오는 21일까지... ","Mon, 15 Aug 2022 14:04:00 +0900"
[속보] 코로나 신규확진 18만803명… 126일 만에 최다,http://moneys.mt.co.kr/news/mwView.php?no=2022081708571785676,https://n.news.naver.com/mnews/article/417/0000843410?sid=102,코로나 신규확진 18만803명… 126일 만에 최다,"Wed, 17 Aug 2022 09:30:00 +0900"
화이자 A. 불라 회장 ‘코로나19’ 양성 판정 공개,http://www.yakup.com/news/index.html?mode=view&cat=16&nid=272386,http://www.yakup.com/news/index.html?mode=view&cat=16&nid=272386,화이자社의 앨버트 불라 회장은 자신이 ‘코로나19’ 검사에서 양성 판정을 받았음을 알리고자 한다고... 불라 회장은 화이자社 및 독일 생명공학기업 바이오엔테크社의 ‘코로나19’ 백신을 4차례에 걸쳐... ,"Tue, 16 Aug 2022 13:26:00 +0900"
"코로나19 위중증 563명, 112일 만에 최다…신규 확진 8만4128명",https://www.asiatoday.co.kr/view.php?key=20220816010008957,https://www.asiatoday.co.kr/view.php?key=20220816010008957,위중증 환자 한 달 새 8배 급증 국내 신종 코로나바이러스 감염증(코로나19) 재유행이 지속되며 위중증 환자 수가 4월 말 이후 최다치를 기록하며 증가세를 이어갔다.16일 중앙방역대책본부에 따르면 이날... ,"Tue, 16 Aug 2022 10:10:00 +0900"
"[서울포토] 빌 게이츠, 오늘 국회서 ‘코로나 국제공조’ 연설… 오후 尹대통...",https://www.seoul.co.kr/news/newsView.php?id=20220816500041&wlog_tag3=naver,https://n.news.naver.com/mnews/article/081/0003294723?sid=100,게이츠 이사장은 이날 주요 정치권 인사와 환담한 뒤 ‘코로나19 및 미래 감염병 대응·대비를 위한 국제공조의 중요성과 대한민국의 리더십’을 주제로 연설한다. 게이츠 이사장은 연설에서 보건 분야 글로벌 협력을... ,"Tue, 16 Aug 2022 11:01:00 +0900"
[속보] 코로나 신규 확진자 8만4128명…위중증 563명,https://www.bntnews.co.kr/article/view/bnt202208160008,https://www.bntnews.co.kr/article/view/bnt202208160008,"©pixabay 중앙방역대책본부는 오늘(16일) 0시 기준으로 신종 코로나바이러스 감염증(코로나19) 위중증 환자는 563명이라고 밝혔다. 코로나19 국내 발생 신규 확진자는 8만3665명, 해외유입 사례는... ","Tue, 16 Aug 2022 09:34:00 +0900"
경북 '코로나19' 확진자 7550명...사망자 5명,http://www.kbsm.net/news/view.php?idx=360429,http://www.kbsm.net/news/view.php?idx=360429,"경북도내 코로나19 확진자가 7550명 늘었다.17일 경북도에 따르면 이날 0시 기준 코로나19 신규 확진자는 전날 대비 7550명(국내 7509, 국외 41명)이 늘어 누적 94만8496명이다. 최근 2주간... ","Wed, 17 Aug 2022 09:38:00 +0900"
"경기도, 이재민 임시주거시설 코로나19 대비 '일일감시체계' 가동",https://www.asiatoday.co.kr/view.php?key=20220816010009437,https://www.asiatoday.co.kr/view.php?key=20220816010009437,임시주거시설에서 코로나19가 확산되지 않도록 시설별 보건소 전담 인력을 지정해 일일 감시체계를... 경기도 이재민 가운데 코로나19 확진자는 현재 안양시 2명으로 확진 후 친인척 자택 등에서 격리하고 있다. 도는... ,"Tue, 16 Aug 2022 16:10:00 +0900"
"“기업 출장, 2026년은 돼야 코로나19 이전 수준 회복할 듯”",https://news.kbs.co.kr/news/view.do?ncd=5533644&amp;ref=A,https://n.news.naver.com/mnews/article/056/0011321375?sid=104,전 세계적으로 기업 출장비 규모가 2026년은 돼야 코로나19 이전 수준으로 회복할 것이란 전망이... 업무여행협회에 따르면 코로나19 발생 이전인 2019년 글로벌 업무 출장비 규모는 1조 4천310억 달러(약 천877조 원)... ,"Tue, 16 Aug 2022 09:04:00 +0900"
"현대바이오, 코로나19 알약 임상 속도 상승세",http://www.yakup.com/news/index.html?mode=view&cat=12&nid=272442,http://www.yakup.com/news/index.html?mode=view&cat=12&nid=272442,코로나19 치료제의 임상 진행 속도가 지난달 개최된 DSMB(데이터안전성모니터링위원회) 이후 빠르게 증가하고 있다. 지난 16일 현대바이오에 따르면 자사의 범용 항바이러스제 후보물질인 CP-COV03의 코로나19 임상... ,"Wed, 17 Aug 2022 14:18:00 +0900"
"화이자 CEO도 코로나 못피했다, 백신 4번 맞고도 양성 판정",https://www.chosun.com/international/international_general/2022/08/16/PLN37RTN7VCT7A3W2KZFGOBLHM/?utm_source=naver&utm_medium=referral&utm_campaign=naver-news,https://n.news.naver.com/mnews/article/023/0003710142?sid=104,코로나 백신을 만드는 미국 제약사 화이자의 앨버트 불라 최고경영자(CEO)가 코로나 양성 판정을 받았다. 불라 CEO는 15일(현지시각) 트위터를 통해 “화이자-바이오엔테크 백신을 4차까지 접종한 데 대해 감사한 마음”... ,"Tue, 16 Aug 2022 08:17:00 +0900"
"양주시 안심식당 지정 확대...""코로나19 재확산 대응""",http://www.newspim.com/news/view/20220816001080,http://www.newspim.com/news/view/20220816001080,"경기 양주시는 코로나19 재확산 대응의 일환으로 시민들이 안심하고 이용할 수 있도록 생활방역수칙을... 시 관계자는 ""안심식당 지정이 코로나19 재확산으로 인한 시민들의 외식업소 이용 불안감을 해소하고 안전하고... ","Tue, 16 Aug 2022 16:33:00 +0900"
[그래픽] 코로나19 확진자 지역별 현황(16일),https://www.news1.kr/photos/view/?5528608,https://n.news.naver.com/mnews/article/421/0006279353?sid=102,이지원 디자이너 = 16일 질병관리청 중앙방역대책본부에 따르면 이날 0시 기준 국내 코로나19 누적 확진자는 8만4128명 증가한 2150만2164명으로 나타났다. 신규 확진자 8만4128명(해외유입 463명... ,"Tue, 16 Aug 2022 10:19:00 +0900"
[속보] 코로나19 신규 확진 18만803명 발생,https://www.wikitree.co.kr/articles/781049,https://www.wikitree.co.kr/articles/781049,코로나19 신규 확진 18만803명 발생 (속보는 한 줄입니다. 후속 보도가 곧 추가됩니다.),"Wed, 17 Aug 2022 09:42:00 +0900"
코로나 확진 6만2078명...위중증 521명으로 한달새 8배,https://www.dongascience.com/news/view/55813,https://n.news.naver.com/mnews/article/584/0000019899?sid=103,"신종 코로나바이러스 감염증(COVID-19·코로나19) 신규 확진자가 15일 6만2078명으로, 일주일 전인 8일과 비교해 1.12배 증가했다. 월요일 기준으로는 18주 만에 6만명대를 넘어섰다. 위중증 환자수도... ","Mon, 15 Aug 2022 11:31:00 +0900"
"중흥그룹, 코로나 극복 위한 릴레이 헌혈",http://theviewers.co.kr/View.aspx?No=2501625,http://theviewers.co.kr/View.aspx?No=2501625,뷰어스 정지수 기­자  중흥그룹이 코로나 극복을 위해 계열사 임직원들이 동참하는 릴레이 헌혈 캠페인에 나섰다.중흥그룹은 지난 16일 중흥건설 본사 앞에서 임직원들이 동참하는 ‘코로나 극복을 위한 헌혈 캠페인’을... ,"Wed, 17 Aug 2022 08:28:00 +0900"
