제목,평점,개요,감독,출연
리볼버,5.25,"범죄, 드라마",가이 리치,"제이슨 스타뎀, 레이 리오타"
녹턴,0.00,다큐멘터리,정관조,
풀타임,8.67,"드라마, 스릴러",에리크 그라벨,"로르 칼라미, 앤 수아레즈, 제네비에브 무니치, 시릴 구이"
파로호,9.00,스릴러,임상수,"이중옥, 김대건"
투란도트 어둠의 왕국,0.00,뮤지컬,김시우,"배다해, 민우혁, 양서윤"
귀멸의 칼날: 남매의 연,6.80,애니메이션,소토자키 하루오,"하나에 나츠키, 키토 아카리, 시모노 히로, 마츠오카 요시츠구"
기도의 숨결,0.00,다큐멘터리,"세실 베스노, 이반 마시카",
놉,6.59,"미스터리, 공포",조던 필,"다니엘 칼루야, 케케 파머, 스티븐 연, 마이클 윈콧, 브랜든 페레아, 바비 페레이라"
바다 탐험대 옥토넛 : 탐험선 대작전,2.98,"애니메이션, 액션, 모험",스테파니 심슨,"하성용, 정재헌, 엄상현, 윤승희, 김율, 유동균, 김정은, 한경화"
"굿 럭 투 유, 리오 그랜드",7.51,"드라마, 코미디",소피 하이드,"엠마 톰슨, 다릴 맥코맥"
멋진 세계,8.30,드라마,니시카와 미와,"야쿠쇼 코지, 나가사와 마사미"
뱅크시,9.07,다큐멘터리,엘리오 에스파냐,"뱅크시, 벤 아인, 스티브 라자리데스, 존 네이션, 펠릭스 ‘FLX’ 브론, 알란 KET, 스케이프 마르티네즈, RISK"
모퉁이,9.07,드라마,신선,"이택근, 하성국, 박봉준"
카우,8.42,다큐멘터리,안드레아 아놀드,
유나바머: 테드 K,8.50,"범죄, 드라마",토니 스톤,"샬토 코플리, 드류 포웰"
헌트,8.48,"액션, 드라마",이정재,"이정재, 정우성"
DC 리그 오브 슈퍼-펫,7.83,"애니메이션, 액션, 모험","자레드 스턴, 샘 J. 레빈","드웨인 존슨, 케빈 하트, 키아누 리브스, 존 크래신스키"
극장판 살아남기 시리즈: 인체에서 살아남기,9.39,애니메이션,"나스카와 미츠루, 이리요시 사토루","김현지, 여민정, 남도형"
베르히만 아일랜드,7.64,"멜로/로맨스, 드라마",미아 한센-러브,"빅키 크리엡스, 팀 로스, 미아 와시코브스카, 앤더스 다니엘슨 리"
보일링 포인트,8.05,"드라마, 스릴러",필립 바랜티니,스테판 그레이엄
비상선언,6.77,드라마,한재림,"송강호, 이병헌, 전도연, 김남길, 임시완, 김소진, 박해준"
극장판 도라에몽: 진구의 우주소전쟁 리틀스타워즈 2021,8.99,애니메이션,야마구치 스스무,"윤아영, 김정아, 이현주, 조현정, 최낙윤"
뽀로로 극장판 드래곤캐슬 대모험,9.17,애니메이션,"강승훈, 윤제완","이선, 이미자, 김현지, 홍소영, 정미숙, 김서영, 김환진, 소연, 김혜성, 이장원, 사문영, 엄상현"
초록밤,8.73,,윤서진,"이태훈, 김민경, 강길우, 김국희, 오민애, 원미원, 변은영"
임파서블 러브,8.50,"드라마, 멜로/로맨스",카트린 코르시니,"비르지니 에피라, 니엘스 슈나이더, 제니 베스"
배드 럭 뱅잉,6.16,"드라마, 코미디",라두 주데,"카티아 파스칼리우, 클라우디아 이레미아, 올림피아 말라이, 니코딤 웅그레아누"
한산: 용의 출현,8.81,"액션, 드라마",김한민,"박해일, 변요한, 안성기, 손현주, 김성규, 김성균, 김향기, 택연, 공명, 박지환, 조재윤"
아이를 위한 아이,8.56,,이승환,"현우석, 박상훈, 정웅인"
미니언즈2,7.68,"애니메이션, 모험, 코미디",카일 발다,"스티브 카렐, 타라지 P. 헨슨, 양자경, 루시 로리스, 장 끌로드 반담"
외계+인 1부,7.45,"액션, 판타지, SF",최동훈,"류준열, 김우빈, 김태리, 소지섭, 염정아, 조우진, 김의성"
썸머 필름을 타고!,7.58,"멜로/로맨스, SF",마츠모토 소우시,"이토 마리카, 카네코 다이치, 이노리 키라라, 카와이 유미"
스파이형 모델,7.00,SF,김영일,"주종혁, 이아주, 장현동, 이병수, 박진수"
로스트 도터,7.71,드라마,매기 질렌할,"올리비아 콜맨, 다코타 존슨, 제시 버클리"
명탐정 코난: 할로윈의 신부,9.48,애니메이션,미츠나카 스스무,
엘비스,8.86,드라마,바즈 루어만,"오스틴 버틀러, 톰 행크스"
체리마호: 30살까지 동정이면 마법사가 될 수 있대,8.92,"판타지, 멜로/로맨스",카자마 히로키,"아카소 에이지, 마치다 케이타, 유타로, 아사카 코다이"
멘,6.13,"드라마, 공포, SF",알렉스 가랜드,"제시 버클리, 로리 키니어"
큐어,8.34,"범죄, 스릴러",구로사와 기요시,"야쿠쇼 코지, 하기와라 마사토, 우지키 츠요시, 나카가와 안나, 오스기 렌"
토르: 러브 앤 썬더,6.49,"액션, 모험, 판타지",타이카 와이티티,"크리스 헴스워스, 나탈리 포트만, 테사 톰슨, 크리스찬 베일, 타이카 와이티티, 크리스 프랫"
헤어질 결심,8.67,"멜로/로맨스, 드라마, 서스펜스",박찬욱,"박해일, 탕웨이, 이정현"
니얼굴,9.41,다큐멘터리,서동일,정은혜
모어,9.22,다큐멘터리,이일하,"모지민, 존 카메론 미첼, 예브게니 슈테판"
탑건: 매버릭,9.77,액션,조셉 코신스키,"톰 크루즈, 마일즈 텔러, 제니퍼 코넬리"
경아의 딸,8.74,,김정은,"김정영, 하윤경, 김우겸, 박혜진"
브로커,5.53,드라마,고레에다 히로카즈,"송강호, 강동원, 배두나, 아이유, 이주영"
애프터 양,8.19,"드라마, SF",코고나다,"콜린 파렐, 조디 터너 스미스, 저스틴 H. 민"
카시오페아,9.08,드라마,신연식,"안성기, 서현진, 주예림"
오마주,8.40,드라마,신수원,"이정은, 권해효, 탕준상, 이주실, 김호정"
"아치의 노래, 정태춘",9.35,다큐멘터리,고영재,"정태춘, 박은옥"
범죄도시2,9.34,"범죄, 액션",이상용,"마동석, 손석구, 최귀화"
우연과 상상,8.19,"드라마, 멜로/로맨스",하마구치 류스케,"후루카와 코토네, 현리, 나카지마 아유무, 모리 카츠키, 시부카와 키요히코, 카이 쇼우마, 우라베 후사코, 카와이 아오바"
소설가의 영화,7.74,드라마,홍상수,"이혜영, 김민희"
중경삼림,8.90,드라마,왕가위,"임청하, 양조위, 왕페이, 금성무"
보드랍게,9.47,다큐멘터리,박문칠,김순악
극장판 주술회전 0,9.24,애니메이션,박성후,"오가타 메구미, 하나자와 카나, 코마츠 미카코, 우치야마 코우키, 세키 토모카즈, 나카무라 유이치, 사쿠라이 타카히로"
호수의 이방인,7.40,"드라마, 스릴러",알랭 기로디,"피에르 델라돈챔프스, 크리스토프 파오우"
코다,9.12,드라마,션 헤이더,"에밀리아 존스, 퍼디아 월시-필로, 트로이 코처, 다니엘 듀런트, 말리 매트린, 에우헤니오 데르베스, 에이미 포사이스"
스파이의 아내,8.15,"서스펜스, 멜로/로맨스",구로사와 기요시,"아오이 유우, 타카하시 잇세이, 히가시데 마사히로, 반도 류타"
테스와 보낸 여름,9.09,드라마,스티븐 바우터루드,"소니 코프스 판 우테렌, 조세핀 아렌센, 트에보 게리츠마, 제니퍼 호프만"
남매의 여름밤,8.96,드라마,윤단비,"최정운, 양흥주, 박현영, 박승준"
킹 오브 프리즘 올 스타즈 -프리즘 쇼☆베스트10-,7.94,애니메이션,히시다 마사카즈,"테라시마 쥰타, 하타나카 타스쿠, 사이토 소우마, 야시로 타쿠, 나가츠카 타쿠마, 우치다 유우마, 아오이 쇼타, 타케우치 슌스케, 스기타 토모카즈, 카키하라 테츠야, 마에노 토모아키, 마스다 토시키"
우먼 인 할리우드,9.11,다큐멘터리,톰 도나휴,"지나 데이비스, 메릴 스트립, 나탈리 포트만, 케이트 블란쳇, 클로이 모레츠, 리즈 위더스푼, 산드라 오, 제시카 차스테인, 조 샐다나, 마리사 토메이, 로사리오 도슨, 질리언 앤더슨, 샤론 스톤"
지구 최후의 밤,7.43,"드라마, 미스터리",비간,"탕웨이, 황각"
녹색 광선,8.42,"멜로/로맨스, 드라마",에릭 로메르,마리 리비에르
천로역정: 천국을 찾아서,8.85,"애니메이션, 모험",로버트 페르난데스,"존 라이스 데이비스, 벤 프라이스"
킹 오브 프리즘 -샤이니 세븐 스타즈- Ⅳ 루이x신x언노운,6.69,애니메이션,히시다 마사카즈,"테라시마 쥰타, 아오이 쇼타"
킹 오브 프리즘 -샤이니 세븐 스타즈- Ⅲ 레오x유우x알렉,6.90,애니메이션,히시다 마사카즈,"나가츠카 타쿠마, 우치다 유우마, 타케우치 슌스케"
킹 오브 프리즘-샤이니 세븐 스타즈-ⅱ카케루x조지x미나토,2.69,애니메이션,히시다 마사카즈,테라시마 쥰타
킹 오브 프리즘 -샤이니 세븐 스타즈-,2.19,애니메이션,히시다 마사카즈,"테라시마 쥰타, 사이토 소우마, 하타나카 타스쿠, 야시로 타쿠"
더 스퀘어,7.70,블랙코미디,루벤 외스틀룬드,클라에스 방
아이 엠 러브,7.84,"드라마, 멜로/로맨스",루카 구아다니노,"틸다 스윈튼, 플라비오 파렌티, 에도아도 가브리엘리니, 알바 로르와처"
킹 오브 프리즘 프라이드 더 히어로,9.12,애니메이션,히시다 마사카즈,"남도형, 엄상현, 이원찬"
킹 오브 프리즘,9.18,"드라마, 애니메이션, 판타지",히시다 마사카즈,"카키하라 테츠야, 마에노 토모아키, 마스다 토시키"
"나, 다니엘 블레이크",9.31,드라마,켄 로치,"데이브 존스, 헤일리 스콰이어"
극장판 프리파라 모두 모여라! 프리즘☆투어즈,7.03,애니메이션,히시다 마사카즈,"아케사카 사토미 , 아스미 카나, 치바 스스무, 고토 사오리, 하라 사유리, 이토 카나에, 카키하라 테츠야, 카토 에미리"
순응자,8.29,드라마,베르나르도 베르톨루치,"장-루이 트린티냥, 스테파니아 산드렐리"
트립 투 잉글랜드,7.14,코미디,마이클 윈터바텀,"스티브 쿠건, 롭 브라이든"
올드보이,9.04,"드라마, 미스터리, 범죄, 스릴러",박찬욱,"최민식, 유지태, 강혜정"
홀리 모터스,7.37,드라마,레오 카락스,"드니 라방, 카일리 미노그, 에바 멘데스, 에디뜨 스꼽"
레미제라블,8.39,드라마,톰 후퍼,"휴 잭맨, 앤 해서웨이, 러셀 크로우, 아만다 사이프리드, 헬레나 본햄 카터, 사챠 바론 코헨"
치코와 리타,8.60,"애니메이션, 멜로/로맨스","하비에르 마리스칼, 페르난도 트루에바, 토노 에란도","에만 소르 오냐, 리마라 메니시스, 마리오 구에라"
하녀,8.95,스릴러,김기영,"김진규, 이은심, 주증녀, 엄앵란, 안성기"
박쥐,6.33,멜로/로맨스,박찬욱,"송강호, 김옥빈"
카모메 식당,8.35,"코미디, 드라마",오기가미 나오코,"고바야시 사토미, 카타기리 하이리"
그 여름 가장 조용한 바다,8.70,드라마,기타노 다케시,"카와하라 사부, 마키 쿠로우도, 오시마 히로코, 테라지마 스스무"
황혼에서 새벽까지,8.08,"액션, 범죄, 공포, 스릴러",로버트 로드리게즈,"하비 케이틀, 조지 클루니, 쿠엔틴 타란티노, 줄리엣 루이스"
펄프 픽션,8.77,"범죄, 드라마, 코미디, 스릴러",쿠엔틴 타란티노,"존 트라볼타, 사무엘 L. 잭슨, 우마 서먼, 하비 케이틀, 팀 로스, 아만다 플러머, 마리아 데 메데이로스, 빙 라메스, 에릭 스톨츠, 로잔나 아퀘트, 크리스토퍼 월켄, 브루스 윌리스"
이 생명 다하도록,8.29,드라마,신상옥,"최은희, 김진규, 전영선, 남궁원"
맨발의 백작부인,7.25,"드라마, 멜로/로맨스",조셉 L. 맨키위즈,"험프리 보가트, 에바 가드너"
